,pmcid,doi,title,authorString,pubYear,abstractText,isOpenAccess,license
19,PMC11139306,10.1371/journal.pbio.3002622,Negation mitigates rather than inverts the neural representations of adjectives.,"Zuanazzi A, Ripollés P, Lin WM, Gwilliams L, King JR, Poeppel D.",2024,"Combinatoric linguistic operations underpin human language processes, but how meaning is composed and refined in the mind of the reader is not well understood. We address this puzzle by exploiting the ubiquitous function of negation. We track the online effects of negation (""not"") and intensifiers (""really"") on the representation of scalar adjectives (e.g., ""good"") in parametrically designed behavioral and neurophysiological (MEG) experiments. The behavioral data show that participants first interpret negated adjectives as affirmative and later modify their interpretation towards, but never exactly as, the opposite meaning. Decoding analyses of neural activity further reveal significant above chance decoding accuracy for negated adjectives within 600 ms from adjective onset, suggesting that negation does not invert the representation of adjectives (i.e., ""not bad"" represented as ""good""); furthermore, decoding accuracy for negated adjectives is found to be significantly lower than that for affirmative adjectives. Overall, these results suggest that negation mitigates rather than inverts the neural representations of adjectives. This putative suppression mechanism of negation is supported by increased synchronization of beta-band neural activity in sensorimotor areas. The analysis of negation provides a steppingstone to understand how the human brain represents changes of meaning over time.",Y,cc by
20,PMC10586433,10.1155/2023/9790234,Retracted: A Lightweight Semantic Segmentation Algorithm Based on Deep Convolutional Neural Networks.,Intelligence And Neuroscience C.,2023,[This retracts the article DOI: 10.1155/2022/5339664.].,Y,cc by
21,PMC10973368,10.1038/s41598-024-57408-0,A deep inverse convolutional neural network-based semantic classification method for land cover remote sensing images.,"Wang M, She A, Chang H, Cheng F, Yang H.",2024,"The imbalance of land cover categories is a common problem. Some categories appear less frequently in the image, while others may occupy the vast majority of the proportion. This imbalance can lead the classifier to tend to predict categories with higher frequency of occurrence, while the recognition effect on minority categories is poor. In view of the difficulty of land cover remote sensing image multi-target semantic classification, a semantic classification method of land cover remote sensing image based on depth deconvolution neural network is proposed. In this method, the land cover remote sensing image semantic segmentation algorithm based on depth deconvolution neural network is used to segment the land cover remote sensing image with multi-target semantic segmentation; Four semantic features of color, texture, shape and size in land cover remote sensing image are extracted by using the semantic feature extraction method of remote sensing image based on improved sequential clustering algorithm; The classification and recognition method of remote sensing image semantic features based on random forest algorithm is adopted to classify and identify four semantic feature types of land cover remote sensing image, and realize the semantic classification of land cover remote sensing image. The experimental results show that after this method classifies the multi-target semantic types of land cover remote sensing images, the average values of Dice similarity coefficient and Hausdorff distance are 0.9877 and 0.9911 respectively, which can accurately classify the multi-target semantic types of land cover remote sensing images.",Y,cc by
22,PMC11150377,10.1038/s41598-024-63623-6,RA-Net: reverse attention for generalizing residual learning.,"Wang Z, Xie X, Yang J, Song X.",2024,"Since residual learning was proposed, identity mapping has been widely utilized in various neural networks. The method enables information transfer without any attenuation, which plays a significant role in training deeper networks. However, interference with unhindered transmission also affects the network's performance. Accordingly, we propose a generalized residual learning architecture called reverse attention (RA), which applies high-level semantic features to supervise low-level information in the identity mapping branch. It means that higher semantic features selectively transmit low-level information to deeper layers. In addition, we propose a Modified Global Response Normalization(M-GRN) to implement reverse attention. RA-Net is derived by embedding M-GRN in the residual learning framework. The experiments show that the RA-Net brings significant improvements over residual networks on typical computer vision tasks. For classification on ImageNet-1K, compared with resnet101, RA-Net improves the Top-1 accuracy by 1.7% with comparable parameters and computational cost. For COCO detection, on Faster R-CNN, reverse attention improves box AP by 1.9%. Meanwhile, reverse attention improves UpperNet's mIoU by 0.7% on ADE20K segmentation.",Y,cc by
23,PMC10567481,10.1155/2023/9837126,Retracted: Emotional Intervention and Education System Construction for Rural Children Based on Semantic Analysis.,International OT.,2023,[This retracts the article DOI: 10.1155/2022/1073717.].,Y,cc by
24,PMC10821911,10.1038/s41598-024-52873-z,Effects of workbook training using editorials and newspaper articles in adults with preclinical stage of dementia.,"Jin S, Yoon JH, Na DL.",2024,"Early detection and intervention in individuals in the pre-clinical stage of dementia are crucial. This study aimed to examine whether there are significant differences in (1) word retrieval, (2) subjective communication ability, (3) intervention satisfaction through the 'Fill-in-the-blanks in editorial and newspaper articles' training in patients with subjective cognitive decline and mild cognitive impairment corresponding to the pre-clinical stage of dementia. Ninety-nine patients (50 in the intervention group and 49 in the control group) aged 50-84 years were administered pre- and post-test after 6 weeks of intervention (30 sessions). Regarding word retrieval, there were significant intervention effects on confrontation naming, semantic fluency, and phonemic fluency. The majority of participants in the intervention group were highly satisfied with the training. In terms of intervention satisfaction, the majority of the participants in the intervention group showed high satisfaction with all the questions. This result confirmed the improvement of word retrieval ability through mass communication content-based 'Fill-in-the-blanks' training, and ultimately helps to provide a clinical basis for applying this intervention to prevent dementia.",Y,cc by
25,PMC11178556,10.1007/s11548-024-03091-5,EndoViT: pretraining vision transformers on a large collection of endoscopic images.,"Batić D, Holm F, Özsoy E, Czempiel T, Navab N.",2024,"<h4>Purpose</h4>Automated endoscopy video analysis is essential for assisting surgeons during medical procedures, but it faces challenges due to complex surgical scenes and limited annotated data. Large-scale pretraining has shown great success in natural language processing and computer vision communities in recent years. These approaches reduce the need for annotated data, which is of great interest in the medical domain. In this work, we investigate endoscopy domain-specific self-supervised pretraining on large collections of data.<h4>Methods</h4>To this end, we first collect Endo700k, the largest publicly available corpus of endoscopic images, extracted from nine public Minimally Invasive Surgery (MIS) datasets. Endo700k comprises more than 700,000 images. Next, we introduce EndoViT, an endoscopy-pretrained Vision Transformer (ViT), and evaluate it on a diverse set of surgical downstream tasks.<h4>Results</h4>Our findings indicate that domain-specific pretraining with EndoViT yields notable advantages in complex downstream tasks. In the case of action triplet recognition, our approach outperforms ImageNet pretraining. In semantic segmentation, we surpass the state-of-the-art (SOTA) performance. These results demonstrate the effectiveness of our domain-specific pretraining approach in addressing the challenges of automated endoscopy video analysis.<h4>Conclusion</h4>Our study contributes to the field of medical computer vision by showcasing the benefits of domain-specific large-scale self-supervised pretraining for vision transformers. We release both our code and pretrained models to facilitate further research in this direction: https://github.com/DominikBatic/EndoViT .",Y,cc by
26,PMC10991757,10.3389/fpsyg.2024.1308098,"Measuring the menu, not the food: ""psychometric"" data may instead measure ""lingometrics"" (and miss its greatest potential).","Arnulf JK, Olsson UH, Nimon K.",2024,"This is a review of a range of empirical studies that use digital text algorithms to predict and model response patterns from humans to Likert-scale items, using texts only as inputs. The studies show that statistics used in construct validation is predictable on sample and individual levels, that this happens across languages and cultures, and that the relationship between variables are often semantic instead of empirical. That is, the relationships among variables are given a priori and evidently computable as such. We explain this by replacing the idea of ""nomological networks"" with ""semantic networks"" to designate computable relationships between abstract concepts. Understanding constructs as nodes in semantic networks makes it clear why psychological research has produced constant average explained variance at 42% since 1956. Together, these findings shed new light on the formidable capability of human minds to operate with fast and intersubjectively similar semantic processing. Our review identifies a categorical error present in much psychological research, measuring representations instead of the purportedly represented. We discuss how this has grave consequences for the empirical truth in research using traditional psychometric methods.",Y,cc by
27,PMC11076349,10.1007/s00701-024-06062-6,An update on tests used for intraoperative monitoring of cognition during awake craniotomy.,"de Zwart B, Ruis C.",2024,"<h4>Purpose</h4>Mapping higher-order cognitive functions during awake brain surgery is important for cognitive preservation which is related to postoperative quality of life. A systematic review from 2018 about neuropsychological tests used during awake craniotomy made clear that until 2017 language was most often monitored and that the other cognitive domains were underexposed (Ruis, J Clin Exp Neuropsychol 40(10):1081-1104, 218). The field of awake craniotomy and cognitive monitoring is however developing rapidly. The aim of the current review is therefore, to investigate whether there is a change in the field towards incorporation of new tests and more complete mapping of (higher-order) cognitive functions.<h4>Methods</h4>We replicated the systematic search of the study from 2018 in PubMed and Embase from February 2017 to November 2023, yielding 5130 potentially relevant articles. We used the artificial machine learning tool ASReview for screening and included 272 papers that gave a detailed description of the neuropsychological tests used during awake craniotomy.<h4>Results</h4>Comparable to the previous study of 2018, the majority of studies (90.4%) reported tests for assessing language functions (Ruis, J Clin Exp Neuropsychol 40(10):1081-1104, 218). Nevertheless, an increasing number of studies now also describe tests for monitoring visuospatial functions, social cognition, and executive functions.<h4>Conclusions</h4>Language remains the most extensively tested cognitive domain. However, a broader range of tests are now implemented during awake craniotomy and there are (new developed) tests which received more attention. The rapid development in the field is reflected in the included studies in this review. Nevertheless, for some cognitive domains (e.g., executive functions and memory), there is still a need for developing tests that can be used during awake surgery.",Y,cc by
28,PMC10874957,10.1038/s41598-024-54640-6,Transductive meta-learning with enhanced feature ensemble for few-shot semantic segmentation.,"Karimi A, Poullis C.",2024,"This paper addresses few-shot semantic segmentation and proposes a novel transductive end-to-end method that overcomes three key problems affecting performance. First, we present a novel ensemble of visual features learned from pretrained classification and semantic segmentation networks with the same architecture. Our approach leverages the varying discriminative power of these networks, resulting in rich and diverse visual features that are more informative than a pretrained classification backbone that is not optimized for dense pixel-wise classification tasks used in most state-of-the-art methods. Secondly, the pretrained semantic segmentation network serves as a base class extractor, which effectively mitigates false positives that occur during inference time and are caused by base objects other than the object of interest. Thirdly, a two-step segmentation approach using transductive meta-learning is presented to address the episodes with poor similarity between the support and query images. The proposed transductive meta-learning method addresses the prediction by first learning the relationship between labeled and unlabeled data points with matching support foreground to query features (intra-class similarity) and then applying this knowledge to predict on the unlabeled query image (intra-object similarity), which simultaneously learns propagation and false positive suppression. To evaluate our method, we performed experiments on benchmark datasets, and the results demonstrate significant improvement with minimal trainable parameters of 2.98M. Specifically, using Resnet-101, we achieve state-of-the-art performance for both 1-shot and 5-shot Pascal-[Formula: see text], as well as for 1-shot and 5-shot COCO-[Formula: see text].",Y,cc by
29,PMC10912646,10.1038/s41598-024-51793-2,The interplay of semantic and syntactic processing across hemispheres.,"Kim S, Nam K, Lee EH.",2024,"The current study investigated the hemispheric dynamics underlying semantic and syntactic priming in lexical decision tasks. Utilizing primed-lateralized paradigms, we observed a distinct pattern of semantic priming contingent on the priming hemisphere. The right hemisphere (RH) exhibited robust semantic priming irrespective of syntactic congruency between prime and target, underscoring its proclivity for semantic processing. Conversely, the left hemisphere (LH) demonstrated slower response times for semantically congruent yet syntactically incongruent word pairs, highlighting its syntactic processing specialization. Additionally, nonword data revealed a hemispheric divergence in syntactic processing, with the LH showing significant intrahemispheric syntactic priming. These findings illuminate the intrinsic hemispheric specializations for semantic and syntactic processing, offering empirical support for serial processing models. The study advances our understanding of the complex interplay between semantic and syntactic factors in hemispheric interactions.",Y,cc by
30,PMC10771426,10.1038/s41598-023-50242-w,Semantic embedding based online cross-modal hashing method.,"Zhang M, Li J, Zheng X.",2024,"Hashing has been extensively utilized in cross-modal retrieval due to its high efficiency in handling large-scale, high-dimensional data. However, most existing cross-modal hashing methods operate as offline learning models, which learn hash codes in a batch-based manner and prove to be inefficient for streaming data. Recently, several online cross-modal hashing methods have been proposed to address the streaming data scenario. Nevertheless, these methods fail to fully leverage the semantic information and accurately optimize hashing in a discrete fashion. As a result, both the accuracy and efficiency of online cross-modal hashing methods are not ideal. To address these issues, this paper introduces the Semantic Embedding-based Online Cross-modal Hashing (SEOCH) method, which integrates semantic information exploitation and online learning into a unified framework. To exploit the semantic information, we map the semantic labels to a latent semantic space and construct a semantic similarity matrix to preserve the similarity between new data and existing data in the Hamming space. Moreover, we employ a discrete optimization strategy to enhance the efficiency of cross-modal retrieval for online hashing. Through extensive experiments on two publicly available multi-label datasets, we demonstrate the superiority of the SEOCH method.",Y,cc by
31,PMC11019695,10.1364/boe.510908,Improved dual-aggregation polyp segmentation network combining a pyramid vision transformer with a fully convolutional network.,"Li F, Huang Z, Zhou L, Chen Y, Tang S, Ding P, Peng H, Chu Y.",2024,"Automatic and precise polyp segmentation in colonoscopy images is highly valuable for diagnosis at an early stage and surgery of colorectal cancer. Nevertheless, it still posed a major challenge due to variations in the size and intricate morphological characteristics of polyps coupled with the indistinct demarcation between polyps and mucosas. To alleviate these challenges, we proposed an improved dual-aggregation polyp segmentation network, dubbed Dua-PSNet, for automatic and accurate full-size polyp prediction by combining both the transformer branch and a fully convolutional network (FCN) branch in a parallel style. Concretely, in the transformer branch, we adopted the B3 variant of pyramid vision transformer v2 (PVTv2-B3) as an image encoder for capturing multi-scale global features and modeling long-distant interdependencies between them whilst designing an innovative multi-stage feature aggregation decoder (MFAD) to highlight critical local feature details and effectively integrate them into global features. In the decoder, the adaptive feature aggregation (AFA) block was constructed for fusing high-level feature representations of different scales generated by the PVTv2-B3 encoder in a stepwise adaptive manner for refining global semantic information, while the ResidualBlock module was devised to mine detailed boundary cues disguised in low-level features. With the assistance of the selective global-to-local fusion head (SGLFH) module, the resulting boundary details were aggregated selectively with these global semantic features, strengthening these hierarchical features to cope with scale variations of polyps. The FCN branch embedded in the designed ResidualBlock module was used to encourage extraction of highly merged fine features to match the outputs of the Transformer branch into full-size segmentation maps. In this way, both branches were reciprocally influenced and complemented to enhance the discrimination capability of polyp features and enable a more accurate prediction of a full-size segmentation map. Extensive experiments on five challenging polyp segmentation benchmarks demonstrated that the proposed Dua-PSNet owned powerful learning and generalization ability and advanced the state-of-the-art segmentation performance among existing cutting-edge methods. These excellent results showed our Dua-PSNet had great potential to be a promising solution for practical polyp segmentation tasks in which wide variations of data typically occurred.",Y,
32,PMC10984971,10.1038/s41598-024-58190-9,Spatial-temporal graph neural ODE networks for skeleton-based action recognition.,"Pan L, Lu J, Tang X.",2024,"In the field of skeleton-based action recognition, accurately recognizing human actions is crucial for applications such as virtual reality and motion analysis. However, this task faces challenges such intraindividual action differences and long-term temporal dependencies. To address these challenges, we propose an innovative model called spatial-temporal graph neural ordinary differential equations (STG-NODE). First, in the data preprocessing stage, the dynamic time warping (DTW) algorithm is used to normalize and calculate 3D skeleton data to facilitate the derivation of customized adjacency matrices for improving the influence of intraindividual action differences. Secondly, a custom ordinary differential equation (ODE) integrator is applied based on the initial conditions of the temporal features, producing a solution function that simulates the dynamic evolution trend of the events of interest. Finally, the outstanding ODE solver is used to numerically solve the time features based on the solution function to increase the influence of long-term dependencies on the recognition accuracy of the model and provide it with a more powerful temporal modeling ability. Through extensive experiments conducted on the NTU RGB+D 60 and Kinetics Skeleton 400 benchmark datasets, we demonstrate the superior performance of STG-NODE in the action recognition domain. The success of the STG-NODE model also provides new ideas and methods for the future development of the action recognition field.",Y,cc by
33,PMC11026521,10.1038/s41598-024-59735-8,Computed tomography-based automated measurement of abdominal aortic aneurysm using semantic segmentation with active learning.,"Kim T, On S, Gwon JG, Kim N.",2024,"Accurate measurement of abdominal aortic aneurysm is essential for selecting suitable stent-grafts to avoid complications of endovascular aneurysm repair. However, the conventional image-based measurements are inaccurate and time-consuming. We introduce the automated workflow including semantic segmentation with active learning (AL) and measurement using an application programming interface of computer-aided design. 300 patients underwent CT scans, and semantic segmentation for aorta, thrombus, calcification, and vessels was performed in 60-300 cases with AL across five stages using UNETR, SwinUNETR, and nnU-Net consisted of 2D, 3D U-Net, 2D-3D U-Net ensemble, and cascaded 3D U-Net. 7 clinical landmarks were automatically measured for 96 patients. In AL stage 5, 3D U-Net achieved the highest dice similarity coefficient (DSC) with statistically significant differences (p < 0.01) except from the 2D-3D U-Net ensemble and cascade 3D U-Net. SwinUNETR excelled in 95% Hausdorff distance (HD95) with significant differences (p < 0.01) except from UNETR and 3D U-Net. DSC of aorta and calcification were saturated at stage 1 and 4, whereas thrombus and vessels were continuously improved at stage 5. The segmentation time between the manual and AL-corrected segmentation using the best model (3D U-Net) was reduced to 9.51 ± 1.02, 2.09 ± 1.06, 1.07 ± 1.10, and 1.07 ± 0.97 min for the aorta, thrombus, calcification, and vessels, respectively (p < 0.001). All measurement and tortuosity ratio measured - 1.71 ± 6.53 mm and - 0.15 ± 0.25. We developed an automated workflow with semantic segmentation and measurement, demonstrating its efficiency compared to conventional methods.",Y,cc by
34,PMC11007792,10.1002/dad2.12577,Examining the propensity and nature of criminal risk behaviours in frontotemporal dementia syndromes and Alzheimer's disease.,"Kumfor F, Wei G, Ries N, Bennett H, D'Mello M, Kaizik C, Piguet O, Hodges JR.",2024,"<h4>Introduction</h4>Some people with dementia develop changes in behaviour and cognition that may lead to interactions with police or the legal system. However, large, prospective case-control studies examining these behaviours are lacking.<h4>Methods</h4>One hundred and forty-four people with dementia and 53 controls completed the Misdemeanours and Transgressions Screener.<h4>Results</h4>Criminal risk behaviours were reported in: 65.6% of behavioural-variant frontotemporal dementia, 46.2% of right-lateralised semantic dementia, and 27.0% of Alzheimer's disease patients. In 19.1% of patients these behaviours led to contact with police or authority figures. Compared to controls, people with dementia showed higher rates of physical assault (<i>p </i>= 0.024), financial/professional recklessness (<i>p </i>= 0.009), and inappropriate behaviours (<i>p</i> <i> </i>= 0.052).<h4>Discussion</h4>Criminal risk behaviours are common across dementia subtypes and may be one of the first clinical signs of frontotemporal dementia. Further research to understand how to balance risk minimisation with an individual's liberties as well as the inappropriate criminalisation of people with dementia is needed.<h4>Highlights</h4>The Misdemeanours and Transgressions Screener is a new tool to assess criminal risk behaviours.Forty-seven percent of patients with dementia show criminal risk behaviour after dementia onset.Behaviours included verbal abuse, traffic violations, physical assault.New onset of criminal risk behaviours >50 years is a clinical sign for frontotemporal dementia.",Y,cc by-nc-nd
