,pmcid,doi,title,authorString,pubYear,abstractText,isOpenAccess,license
35,PMC10923834,10.1038/s41598-024-56211-1,MFCA-Net: a deep learning method for semantic segmentation of remote sensing images.,"Li X, Li J.",2024,"Semantic segmentation of remote sensing images (RSI) is an important research direction in remote sensing technology. This paper proposes a multi-feature fusion and channel attention network, MFCA-Net, aiming to improve the segmentation accuracy of remote sensing images and the recognition performance of small target objects. The architecture is built on an encoding-decoding structure. The encoding structure includes the improved MobileNet V2 (IMV2) and multi-feature dense fusion (MFDF). In IMV2, the attention mechanism is introduced twice to enhance the feature extraction capability, and the design of MFDF can obtain more dense feature sampling points and larger receptive fields. In the decoding section, three branches of shallow features of the backbone network are fused with deep features, and upsampling is performed to achieve the pixel-level classification. Comparative experimental results of the six most advanced methods effectively prove that the segmentation accuracy of the proposed network has been significantly improved. Furthermore, the recognition degree of small target objects is higher. For example, the proposed MFCA-Net achieves about 3.65-23.55% MIoU improvement on the dataset Vaihingen.",Y,cc by
36,PMC11002062,10.1016/j.heliyon.2024.e28701,A Bayesian probabilistic analysis of the use of English modal verbs in L2 writing: Focusing on L1 influence and topic effects.,"Bozdağ FÜ, Morris G, Mo J.",2024,"Modal verbs, with their multifaceted semantic nuances and varied grammatical configurations, present notable challenges for L2 learners and regularly intrigue L2 researchers. This study attempts to investigate and compare how English modal verbs are used by L2 learners from different L1 backgrounds. By exploring the Turkish and Chinese learners' subcorpora of the International Corpus of Learner English (ICLE), this work scrutizes the overall frequencies of nine core English modal verbs as grouped into three major semantic classes along with the influential lexico-syntatic variables that are semantic classes of collocated verbs, grammatical patterns and subject pronominality. The results of a Bayesian probabilistic analysis show that both the Turkish and Chinese learners primed similar modal verbs and constructional preferences without topic as the normalizing factor. While the broader analysis reveals no statistically significant divergences between these two learner groups in English modal verb preferences, a pronounced contextual influence is evident when the dataset narrows to essays on a unified theme. This nuanced shift underscores the intricate relationship between essay topics and linguistic structures, thus emphasizing the pivotal role of context in modal verb usage.",Y,cc by
37,PMC10965085,10.1371/journal.pone.0298650,Anomalous diffusion analysis of semantic evolution in major Indo-European languages.,"Asztalos B, Palla G, Czégel D.",2024,"How do words change their meaning? Although semantic evolution is driven by a variety of distinct factors, including linguistic, societal, and technological ones, we find that there is one law that holds universally across five major Indo-European languages: that semantic evolution is subdiffusive. Using an automated pipeline of diachronic distributional semantic embedding that controls for underlying symmetries, we show that words follow stochastic trajectories in meaning space with an anomalous diffusion exponent α = 0.45 ± 0.05 across languages, in contrast with diffusing particles that follow α = 1. Randomization methods indicate that preserving temporal correlations in semantic change directions is necessary to recover strongly subdiffusive behavior; however, correlations in change sizes play an important role too. We furthermore show that strong subdiffusion is a robust phenomenon under a wide variety of choices in data analysis and interpretation, such as the choice of fitting an ensemble average of displacements or averaging best-fit exponents of individual word trajectories.",Y,cc by
38,PMC11069517,10.1038/s41597-024-03317-w,A Dataset for Evaluating Contextualized Representation of Biomedical Concepts in Language Models.,"Rouhizadeh H, Nikishina I, Yazdani A, Bornet A, Zhang B, Ehrsam J, Gaudet-Blavignac C, Naderi N, Teodoro D.",2024,"Due to the complexity of the biomedical domain, the ability to capture semantically meaningful representations of terms in context is a long-standing challenge. Despite important progress in the past years, no evaluation benchmark has been developed to evaluate how well language models represent biomedical concepts according to their corresponding context. Inspired by the Word-in-Context (WiC) benchmark, in which word sense disambiguation is reformulated as a binary classification task, we propose a novel dataset, BioWiC, to evaluate the ability of language models to encode biomedical terms in context. BioWiC comprises 20'156 instances, covering over 7'400 unique biomedical terms, making it the largest WiC dataset in the biomedical domain. We evaluate BioWiC both intrinsically and extrinsically and show that it could be used as a reliable benchmark for evaluating context-dependent embeddings in biomedical corpora. In addition, we conduct several experiments using a variety of discriminative and generative large language models to establish robust baselines that can serve as a foundation for future research.",Y,cc by
39,PMC11076558,10.1038/s41598-024-61140-0,Universal and cultural factors shape body part vocabularies.,"Tjuka A, Forkel R, List JM.",2024,"Every human has a body. Yet, languages differ in how they divide the body into parts to name them. While universal naming strategies exist, there is also variation in the vocabularies of body parts across languages. In this study, we investigate the similarities and differences in naming two separate body parts with one word, i.e., colexifications. We use a computational approach to create networks of body part vocabularies across languages. The analyses focus on body part networks in large language families, on perceptual features that lead to colexifications of body parts, and on a comparison of network structures in different semantic domains. Our results show that adjacent body parts are colexified frequently. However, preferences for perceptual features such as shape and function lead to variations in body part vocabularies. In addition, body part colexification networks are less varied across language families than networks in the semantic domains of emotion and colour. The study presents the first large-scale comparison of body part vocabularies in 1,028 language varieties and provides important insights into the variability of a universal human domain.",Y,cc by
40,PMC11136954,10.1038/s41598-024-61981-9,An accurate semantic segmentation model for bean seedlings and weeds identification based on improved ERFnet.,"Gao H, Qi M, Du B, Yang S, Li H, Wang T, Zhong W, Tang Y.",2024,"In agricultural production activities, the growth of crops always accompanies the competition of weeds for nutrients and sunlight. In order to mitigate the adverse effects of weeds on yield, we apply semantic segmentation techniques to differentiate between seedlings and weeds, leading to precision weeding. The proposed EPAnet employs a loss function coupled with Cross-entropy loss and Dice loss to enhance attention to feature information. A multi-Decoder cooperative module based on ERFnet is designed to enhance information transfer during feature mapping. The SimAM is introduced to enhance position recognition. DO-CONV is used to replace the traditional convolution Feature Pyramid Networks (FPN) connection layer to integrate feature information, improving the model's performance on leaf edge processing, and is named FDPN. Moreover, the Overall Accuracy has been improved by 0.65%, the mean Intersection over Union (mIoU) by 1.91%, and the Frequency-Weighted Intersection over Union (FWIoU) by 1.19%. Compared to other advanced methods, EPAnet demonstrates superior image segmentation results in complex natural environments with uneven lighting, leaf interference, and shadows.",Y,cc by
41,PMC10928072,10.1038/s41598-024-56571-8,Shared structure of fundamental human experience revealed by polysemy network of basic vocabularies across languages.,"Liang Y, Xu K, Ran Q.",2024,"How are concepts related to fundamental human experiences organized within the human mind? Our insights are drawn from a semantic network created using the Cross-Linguistic Database of Polysemous Basic Vocabulary, which focuses on a broad range of senses extracted from dictionary entries. The database covers 60 basic vocabularies in 61 languages, providing 11,841 senses from 3736 entries, revealing cross-linguistic semantic connections through automatically generated weighted semantic maps. The network comprises 2941 nodes connected by 3573 edges. The nodes representing body parts, motions, and features closely related to human experience occupy wide fields or serve as crucial bridges across semantic domains in the network. The polysemous network of basic vocabularies across languages represents a shared cognitive network of fundamental human experiences, as these semantic connections should be conceived as generally independent of any specific language and are driven by universal characteristics of the real world as perceived by the human mind. The database holds the potential to contribute to research aimed at unraveling the nature of cognitive proximity.",Y,cc by
42,PMC10987776,10.3389/fpls.2024.1361716,A new model construction based on the knowledge graph for mining elite polyphenotype genes in crops.,"Zhang D, Zhao R, Xian G, Kou Y, Ma W.",2024,"Identifying polyphenotype genes that simultaneously regulate important agronomic traits (e.g., plant height, yield, and disease resistance) is critical for developing novel high-quality crop varieties. Predicting the associations between genes and traits requires the organization and analysis of multi-dimensional scientific data. The existing methods for establishing the relationships between genomic data and phenotypic data can only elucidate the associations between genes and individual traits. However, there are relatively few methods for detecting elite polyphenotype genes. In this study, a knowledge graph for traits regulating-genes was constructed by collecting data from the PubMed database and eight other databases related to the staple food crops rice, maize, and wheat as well as the model plant <i>Arabidopsis thaliana</i>. On the basis of the knowledge graph, a model for predicting traits regulating-genes was constructed by combining the data attributes of the gene nodes and the topological relationship attributes of the gene nodes. Additionally, a scoring method for predicting the genes regulating specific traits was developed to screen for elite polyphenotype genes. A total of 125,591 nodes and 547,224 semantic relationships were included in the knowledge graph. The accuracy of the knowledge graph-based model for predicting traits regulating-genes was 0.89, the precision rate was 0.91, the recall rate was 0.96, and the F1 value was 0.94. Moreover, 4,447 polyphenotype genes for 31 trait combinations were identified, among which the rice polyphenotype gene <i>IPA1</i> and the <i>A. thaliana</i> polyphenotype gene <i>CUC2</i> were verified via a literature search. Furthermore, the wheat gene <i>TraesCS5A02G275900</i> was revealed as a potential polyphenotype gene that will need to be further characterized. Meanwhile, the result of venn diagram analysis between the polyphenotype gene datasets (consists of genes that are predicted by our model) and the transcriptome gene datasets (consists of genes that were differential expression in response to disease, drought or salt) showed approximately 70% and 54% polyphenotype genes were identified in the transcriptome datasets of Arabidopsis and rice, respectively. The application of the model driven by knowledge graph for predicting traits regulating-genes represents a novel method for detecting elite polyphenotype genes.",Y,cc by
43,PMC11088250,10.1016/j.heliyon.2024.e30184,Artificial intelligence in judicial adjudication: Semantic biasness classification and identification in legal judgement (SBCILJ).,"Javed K, Li J.",2024,"History reveals that human societies have suffered in terms of social justice due to cognitive bias. Semantic bias tends to amplify cognitive bias. Therefore, the presence of cognitive biases in extensive historical data can potentially result in unethical and allegedly inhumane predictions since AI systems are trained on this data. The innovation of artificial intelligence and its rapid integration across disciplines has prompted questions regarding the subjectivity of the technology. Current research focuses the semantic bias in legal judgment to increase the legitimacy of training data. By the application of general-purpose Artificial Intelligence (AI) algorithms, we classify and detect the semantics bias that is present in the Chinese Artificial Intelligence and Law (CAIL) dataset. Our findings demonstrate that AI models acquire superior prediction power in the CAIL dataset, which is comprised of hundreds of cases, compared to a structured professional risk assessment tool. To assist legal practitioners during this process, innovative approaches that are based on AI may be implemented inside the legal arena. To accomplish this objective, we suggested a classification model for semantic bias that is related to the classification and identification of semantic biases in legal judgment. Our proposed model legal field uses the example of categorization along with the identification of the CAIL dataset. This will be accomplished by identifying the semantics biases in judicial decisions. We used different types of classifiers such as the Support Vector Machine (SVM), Naïve-Bayes (NB), Multi-Layer Perceptron (MLP), and the K-Nearest Neighbour (KNN) to come across the preferred results. SVM got 96.90 %, NB has 88.80 %, MLP has 86.75 % and KNN achieved 85.66 % accuracy whereas SVM achieved greater accuracy as compared to other models. Additionally, we demonstrate that we were able to get a relatively high classification performance when predicting outcomes based just on the semantic bias categorization in judicial judgments that determine the outcome of the case.",Y,cc by-nc-nd
44,PMC11178169,10.1371/journal.pone.0304835,Multi-source heterogeneous blockchain data quality assessment model for enterprise business activities.,"Zhang H, Zhang R, Li S, Du L, Song B, Ji W, Wang J.",2024,"Blockchain-based applications are becoming more and more widespread in business operations. In view of the shortcomings of existing enterprise blockchain evaluation methods, this paper proposes a multi-source heterogeneous blockchain data quality evaluation model for enterprise business activities, so as to achieve efficient evaluation of business activity information consistency, credibility and value. This paper proposes a multi-source heterogeneous blockchain data quality assessment method for enterprise business activities, aiming at the problems that most of the data in enterprise business activities come from different data sources, information representation is inconsistent, information ambiguity between the same block chain is serious, and it is difficult to evaluate the consistency, credibility and value of information. The method firstly proposes an entity information representation method based on the Representation learning for fusing entity category information (CEKGRL) model, which introduces the triad structure of related entities in blockchain, then associates them with enterprise business activity categories, and carries out similarity calculation through contextual information to achieve blockchain information consistency assessment. After that, a trustworthiness characterization method is proposed based on information sources, information comments, and information contents, to obtain the trustworthiness assessment of the business. Finally, based on the information trustworthiness characterization, a value assessment method is introduced to assess the total value of business activity information in the blockchain, and a blockchain quality assessment model is constructed. The experimental results show that the proposed model has great advantages over existing methods in assessing inter-block consistency, intra-block activity information trustworthiness and the value of blockchain.",Y,cc by
45,PMC10957894,10.1038/s41598-024-56897-3,The neural basis of naturalistic semantic and social cognition.,"Thye M, Hoffman P, Mirman D.",2024,"Decoding social environments and engaging meaningfully with other people are critical aspects of human cognition. Multiple cognitive systems, including social and semantic cognition, work alongside each other to support these processes. This study investigated shared processing between social and semantic systems using neuroimaging data collected during movie-viewing, which captures the multimodal environment in which social knowledge is exchanged. Semantic and social content from movie events (event-level) and movie transcripts (word-level) were used in parametric modulation analyses to test (1) the degree to which semantic and social information is processed within each respective network and (2) engagement of the same cross-network regions or the same domain-general hub located within the semantic network during semantic and social processing. Semantic word and event-level content engaged the same fronto-temporo-parietal network and a portion of the semantic hub in the anterior temporal lobe (ATL). Social word and event-level content engaged the supplementary motor area and right angular gyrus within the social network, but only social words engaged the domain-general semantic hub in left ATL. There was evidence of shared processing between the social and semantic systems in the dorsolateral portion of right ATL which was engaged by word and event-level semantic and social content. Overlap between the semantic and social word and event results was highly variable within and across participants, with the most consistent loci of overlap occurring in left inferior frontal, bilateral precentral and supramarginal gyri for social and semantic words and in bilateral superior temporal gyrus extending from ATL posteriorly into supramarginal gyri for social and semantic events. These results indicate a complex pattern of shared and distinct regions for social and semantic cognition during naturalistic processing. PROTOCOL REGISTRATION: The stage 1 protocol for this Registered Report was accepted in principle on October 11, 2022. The protocol, as accepted by the journal, can be found at: https://doi.org/10.17605/OSF.IO/ACWQY .",Y,cc by
46,PMC10824049,10.1162/jocn_a_02057,Evidence of Impaired Remote Experience-near Semantic Memory in Medial Temporal Lobe Amnesia.,"Grilli MD, Sabharwal-Siddiqi S, Thayer SC, Rapcsak SZ, Ekstrom AD.",2023,"Neuropsychological research suggests that ""experience-near"" semantic memory, meaning knowledge attached to a spatiotemporal or event context, is commonly impaired in individuals who have medial temporal lobe amnesia. It is not known if this impairment extends to remotely acquired experience-near knowledge, which is a question relevant to understanding hippocampal/medial temporal lobe functioning. In the present study, we administered a novel semantic memory task designed to target knowledge associated with remote, ""dormant"" concepts, in addition to knowledge associated with active concepts, to four individuals with medial temporal lobe amnesia and eight matched controls. We found that the individuals with medial temporal lobe amnesia generated significantly fewer experience-near semantic memories for both remote concepts and active concepts. In comparison, the generation of abstract or ""experience-far"" knowledge was largely spared in the individuals with medial temporal lobe amnesia, regardless of whether the targets for retrieval were remote or active concepts. We interpret these findings as evidence that the medial temporal lobes may have a sustained role in the retrieval of semantic memories associated with spatiotemporal and event contexts, which are cognitive features often ascribed to episodic memory. These results align with recent theoretical models proposing that the hippocampus/medial temporal lobes support cognitive processes that are involved in, but not exclusive to, episodic memory.",N,
47,PMC10914777,10.1038/s41598-024-56090-6,"Computer programmers show distinct, expertise-dependent brain responses to violations in form and meaning when reading code.","Kuo CH, Prat CS.",2024,"As computer programming becomes more central to the workforce, the need for better models of how it is effectively learned has become more apparent. The current study addressed this gap by recording electrophysiological brain responses as 62 Python programmers with varying skill levels read lines of code with manipulations of form (syntax) and meaning (semantics). At the group level, results showed that manipulations of form resulted in P600 effects, with syntactically invalid code generating more positive deflections in the 500-800 ms range than syntactically valid code. Meaning manipulations resulted in N400 effects, with semantically implausible code generating more negative deflections in the 300-500 ms range than semantically plausible code. Greater Python expertise within the group was associated with greater sensitivity to violations in form. These results support the notion that skilled programming, like skilled natural language learning, is associated with the incorporation of rule-based knowledge into online comprehension processes. Conversely, programmers at all skill levels showed neural sensitivity to meaning manipulations, suggesting that reliance on pre-existing semantic relationships facilitates code comprehension across skill levels.",Y,cc by
48,PMC10497750,10.3389/frai.2023.1225213,Profiling the barriers to the spreading of news using news headlines.,"Sittar A, Mladenić D, Grobelnik M.",2023,"News headlines can be a good data source for detecting the barriers to the spreading of news in news media, which can be useful in many real-world applications. In this study, we utilize semantic knowledge through the inference-based model COMET and the sentiments of news headlines for barrier classification. We consider five barriers, including cultural, economic, political, linguistic, and geographical and different types of news headlines, including health, sports, science, recreation, games, homes, society, shopping, computers, and business. To that end, we collect and label the news headlines automatically for the barriers using the metadata of news publishers. Then, we utilize the extracted common-sense inferences and sentiments as features to detect the barriers to the spreading of news. We compare our approach to the classical text classification methods, deep learning, and transformer-based methods. The results show that (1) the inference-based semantic knowledge provides distinguishable inferences across the 10 categories that can increase the effectiveness and enhance the speed of the classification model; (2) the news of positive sentiments cross the political barrier, whereas the news of negative sentiments cross the cultural, economic, linguistic, and geographical barriers; (3) the proposed approach using inferences-based semantic knowledge and sentiment improves performance compared with using only headlines in barrier classification. The average F1-score for 4 out of 5 barriers has significantly improved as follows: for cultural barriers from 0.41 to 0.47, for economic barriers from 0.39 to 0.55, for political barriers from 0.59 to 0.70 and for geographical barriers from 0.59 to 0.76.",Y,cc by
