,pmcid,doi,title,authorString,pubYear,abstractText,isOpenAccess,license
0,PMC10280262,10.7717/peerj-cs.1159,Nanopublication-based semantic publishing and reviewing: a field study with formalization papers.,"Bucur CI, Kuhn T, Ceolin D, van Ossenbruggen J.",2023,"With the rapidly increasing amount of scientific literature, it is getting continuously more difficult for researchers in different disciplines to keep up-to-date with the recent findings in their field of study. Processing scientific articles in an automated fashion has been proposed as a solution to this problem, but the accuracy of such processing remains very poor for extraction tasks beyond the most basic ones (like locating and identifying entities and simple classification based on predefined categories). Few approaches have tried to change how we publish scientific results in the first place, such as by making articles machine-interpretable by expressing them with formal semantics from the start. In the work presented here, we propose a first step in this direction by setting out to demonstrate that we can formally publish high-level scientific claims in formal logic, and publish the results in a special issue of an existing journal. We use the concept and technology of nanopublications for this endeavor, and represent not just the submissions and final papers in this RDF-based format, but also the whole process in between, including reviews, responses, and decisions. We do this by performing a field study with what we call formalization papers, which contribute a novel formalization of a previously published claim. We received 15 submissions from 18 authors, who then went through the whole publication process leading to the publication of their contributions in the special issue. Our evaluation shows the technical and practical feasibility of our approach. The participating authors mostly showed high levels of interest and confidence, and mostly experienced the process as not very difficult, despite the technical nature of the current user interfaces. We believe that these results indicate that it is possible to publish scientific results from different fields with machine-interpretable semantics from the start, which in turn opens countless possibilities to radically improve in the future the effectiveness and efficiency of the scientific endeavor as a whole.",Y,cc by
1,PMC11192941,10.1038/s41598-024-64858-z,Author Correction: Research on underwater robot ranging technology based on semantic segmentation and binocular vision.,"Hu Q, Wang K, Ren F, Wang Z.",2024,,Y,cc by
2,PMC2663789,10.1371/journal.pcbi.1000361,Adventures in semantic publishing: exemplar semantic enhancements of a research article.,"Shotton D, Portwin K, Klyne G, Miles A.",2009,"Scientific innovation depends on finding, integrating, and re-using the products of previous research. Here we explore how recent developments in Web technology, particularly those related to the publication of data and metadata, might assist that process by providing semantic enhancements to journal articles within the mainstream process of scholarly journal publishing. We exemplify this by describing semantic enhancements we have made to a recent biomedical research article taken from PLoS Neglected Tropical Diseases, providing enrichment to its content and increased access to datasets within it. These semantic enhancements include provision of live DOIs and hyperlinks; semantic markup of textual terms, with links to relevant third-party information resources; interactive figures; a re-orderable reference list; a document summary containing a study summary, a tag cloud, and a citation analysis; and two novel types of semantic enrichment: the first, a Supporting Claims Tooltip to permit ""Citations in Context"", and the second, Tag Trees that bring together semantically related terms. In addition, we have published downloadable spreadsheets containing data from within tables and figures, have enriched these with provenance information, and have demonstrated various types of data fusion (mashups) with results from other research articles and with Google Maps. We have also published machine-readable RDF metadata both about the article and about the references it cites, for which we developed a Citation Typing Ontology, CiTO (http://purl.org/net/cito/). The enhanced article, which is available at http://dx.doi.org/10.1371/journal.pntd.0000228.x001, presents a compelling existence proof of the possibilities of semantic publication. We hope the showcase of examples and ideas it contains, described in this paper, will excite the imaginations of researchers and publishers, stimulating them to explore the possibilities of semantic publishing for their own research articles, and thereby break down present barriers to the discovery and re-use of information within traditional modes of scholarly communication.",Y,cc by
3,PMC10876301,10.1155/2024/9804280,Retracted: Dynamic Data Infrastructure Security for Interoperable e-Healthcare Systems: A Semantic Feature-Driven NoSQL Intrusion Attack Detection Model.,International BR.,2024,[This retracts the article DOI: 10.1155/2022/4080199.].,Y,cc by
4,PMC11087458,10.1038/s41597-024-03185-4,A maturity model for catalogues of semantic artefacts.,"Corcho O, Ekaputra FJ, Heibi I, Jonquet C, Micsik A, Peroni S, Storti E.",2024,"This work presents a maturity model for assessing catalogues of semantic artefacts, one of the keystones that permit semantic interoperability of systems. We defined the dimensions and related features to include in the maturity model by analysing the current literature and existing catalogues of semantic artefacts provided by experts. In addition, we assessed 26 different catalogues to demonstrate the effectiveness of the maturity model, which includes 12 different dimensions (Metadata, Openness, Quality, Availability, Statistics, PID, Governance, Community, Sustainability, Technology, Transparency, and Assessment) and 43 related features (or sub-criteria) associated with these dimensions. Such a maturity model is one of the first attempts to provide recommendations for governance and processes for preserving and maintaining semantic artefacts and helps assess/address interoperability challenges.",Y,cc by
5,PMC11061179,10.1038/s41597-024-03169-4,Semantic integration of diverse data in materials science: Assessing Orowan strengthening.,"Bayerlein B, Schilling M, von Hartrott P, Waitelonis J.",2024,"This study applies Semantic Web technologies to advance Materials Science and Engineering (MSE) through the integration of diverse datasets. Focusing on a 2000 series age-hardenable aluminum alloy, we correlate mechanical and microstructural properties derived from tensile tests and dark-field transmission electron microscopy across varied aging times. An expandable knowledge graph, constructed using the Tensile Test and Precipitate Geometry Ontologies aligned with the PMD Core Ontology, facilitates this integration. This approach adheres to FAIR principles and enables sophisticated analysis via SPARQL queries, revealing correlations consistent with the Orowan mechanism. The study highlights the potential of semantic data integration in MSE, offering a new approach for data-centric research and enhanced analytical capabilities.",Y,cc by
6,PMC11153642,10.1038/s41598-024-63279-2,A novel model for relation prediction in knowledge graphs exploiting semantic and structural feature integration.,"Yang J, Lu G, He S, Cao Q, Liu Y.",2024,"Relation prediction is a critical task in knowledge graph completion and associated downstream tasks that rely on knowledge representation. Previous studies indicate that both structural features and semantic information are meaningful for predicting missing relations in knowledge graphs. This has led to the development of two types of methods: structure-based methods and semantics-based methods. Since these two approaches represent two distinct learning paradigms, it is difficult to fully utilize both sets of features within a single learning model, especially deep features. As a result, existing studies usually focus on only one type of feature. This leads to an insufficient representation of knowledge in current methods and makes them prone to overlooking certain patterns when predicting missing relations. In this study, we introduce a novel model, RP-ISS, which combines deep semantic and structural features for relation prediction. The RP-ISS model utilizes a two-part architecture, with the first component being a RoBERTa module that is responsible for extracting semantic features from entity nodes. The second part of the system employs an edge-based relational message-passing network designed to capture and interpret structural information within the data. To alleviate the computational burden of the message-passing network on the RoBERTa module during the sampling process, RP-ISS introduces a node embedding memory bank, which updates asynchronously to circumvent excessive computation. The model was assessed on three publicly accessible datasets (WN18RR, WN18, and FB15k-237), and the results revealed that RP-ISS surpasses all baseline methods across all evaluation metrics. Moreover, RP-ISS showcases robust performance in graph inductive learning.",Y,cc by
7,PMC11079068,10.1038/s41467-024-48115-5,Semantic regularization of electromagnetic inverse problems.,"Zhang H, Chen Y, Wang Z, Cui TJ, Del Hougne P, Li L.",2024,"Solving ill-posed inverse problems typically requires regularization based on prior knowledge. To date, only prior knowledge that is formulated mathematically (e.g., sparsity of the unknown) or implicitly learned from quantitative data can be used for regularization. Thereby, semantically formulated prior knowledge derived from human reasoning and recognition is excluded. Here, we introduce and demonstrate the concept of semantic regularization based on a pre-trained large language model to overcome this vexing limitation. We study the approach, first, numerically in a prototypical 2D inverse scattering problem, and, second, experimentally in 3D and 4D compressive microwave imaging problems based on programmable metasurfaces. We highlight that semantic regularization enables new forms of highly-sought privacy protection for applications like smart homes, touchless human-machine interaction and security screening: selected subjects in the scene can be concealed, or their actions and postures can be altered in the reconstruction by manipulating the semantic prior with suitable language-based control commands.",Y,cc by
8,PMC11045089,10.1371/journal.pdig.0000501,PLOS-LLM: Can and should AI enable a new paradigm of scientific knowledge sharing?,"Hughes RC, van Heerden A.",2024,,Y,cc by
9,PMC11186750,10.1038/s41586-024-07421-0,Detecting hallucinations in large language models using semantic entropy.,"Farquhar S, Kossen J, Kuhn L, Gal Y.",2024,"Large language model (LLM) systems, such as ChatGPT<sup>1</sup> or Gemini<sup>2</sup>, can show impressive reasoning and question-answering capabilities but often 'hallucinate' false outputs and unsubstantiated answers<sup>3,4</sup>. Answering unreliably or without the necessary information prevents adoption in diverse fields, with problems including fabrication of legal precedents<sup>5</sup> or untrue facts in news articles<sup>6</sup> and even posing a risk to human life in medical domains such as radiology<sup>7</sup>. Encouraging truthfulness through supervision or reinforcement has been only partially successful<sup>8</sup>. Researchers need a general method for detecting hallucinations in LLMs that works even with new and unseen questions to which humans might not know the answer. Here we develop new methods grounded in statistics, proposing entropy-based uncertainty estimators for LLMs to detect a subset of hallucinations-confabulations-which are arbitrary and incorrect generations. Our method addresses the fact that one idea can be expressed in many ways by computing uncertainty at the level of meaning rather than specific sequences of words. Our method works across datasets and tasks without a priori knowledge of the task, requires no task-specific data and robustly generalizes to new tasks not seen before. By detecting when a prompt is likely to produce a confabulation, our method helps users understand when they must take extra care with LLMs and opens up new possibilities for using LLMs that are otherwise prevented by their unreliability.",Y,cc by
10,PMC10701029,10.1155/2023/9784387,Retracted: Location-Dependent Query Processing: Semantic Cache for Real-Time Smart City Analytics.,And Biomechanics AB.,2023,[This retracts the article DOI: 10.1155/2021/9958647.].,Y,cc by
11,PMC10747896,10.3390/s23249652,A Privacy-Preserving Trajectory Publishing Method Based on Multi-Dimensional Sub-Trajectory Similarities.,"Shen H, Wang Y, Zhang M.",2023,"With the popularity of location services and the widespread use of trajectory data, trajectory privacy protection has become a popular research area. <i>k</i>-anonymity technology is a common method for achieving privacy-preserved trajectory publishing. When constructing virtual trajectories, most existing trajectory <i>k</i>-anonymity methods just consider point similarity, which results in a large dummy trajectory space. Suppose there are <i>n</i> similar point sets, each consisting of <i>m</i> points. The size of the space is then mn. Furthermore, to choose suitable <i>k</i>- 1 dummy trajectories for a given real trajectory, these methods need to evaluate the similarity between each trajectory in the space and the real trajectory, leading to a large performance overhead. To address these challenges, this paper proposes a <i>k</i>-anonymity trajectory privacy protection method based on the similarity of sub-trajectories. This method not only considers the multidimensional similarity of points, but also synthetically considers the area between the historic sub-trajectories and the real sub-trajectories to more fully describe the similarity between sub-trajectories. By quantifying the area enclosed by sub-trajectories, we can more accurately capture the spatial relationship between trajectories. Finally, our approach generates k-1 dummy trajectories that are indistinguishable from real trajectories, effectively achieving <i>k</i>-anonymity for a given trajectory. Furthermore, our proposed method utilizes real historic sub-trajectories to generate dummy trajectories, making them more authentic and providing better privacy protection for real trajectories. In comparison to other frequently employed trajectory privacy protection methods, our method has a better privacy protection effect, higher data quality, and better performance.",Y,cc by
12,PMC11198863,10.1371/journal.pone.0289384,Registered report: Age-preserved semantic memory and the CRUNCH effect manifested as differential semantic control networks: An fMRI study.,"Haitas N, Dubuc J, Massé-Leblanc C, Chamberland V, Amiri M, Glatard T, Wilson M, Joanette Y, Steffener J.",2024,"Semantic memory representations are generally well maintained in aging, whereas semantic control is thought to be more affected. To explain this phenomenon, this study tested the predictions of the Compensation-Related Utilization of Neural Circuits Hypothesis (CRUNCH), focusing on task demands in aging as a possible framework. The CRUNCH effect would manifest itself in semantic tasks through a compensatory increase in neural activation in semantic control network regions but only up to a certain threshold of task demands. This study compares 39 younger (20-35 years old) with 39 older participants (60-75 years old) in a triad-based semantic judgment task performed in an fMRI scanner while manipulating task demand levels (low versus high) through semantic distance. In line with the CRUNCH predictions, differences in neurofunctional activation and behavioral performance (accuracy and response times) were expected in younger versus older participants in the low- versus high-demand conditions, which should be manifested in semantic control Regions of Interest (ROIs). Our older participants had intact behavioral performance, as proposed in the literature for semantic memory tasks (maintained accuracy and slower response times (RTs)). Age-invariant behavioral performance in the older group compared to the younger one is necessary to test the CRUNCH predictions. The older adults were also characterized by high cognitive reserve, as our neuropsychological tests showed. Our behavioral results confirmed that our task successfully manipulated task demands: error rates, RTs and perceived difficulty increased with increasing task demands in both age groups. We did not find an interaction between age group and task demand, or a statistically significant difference in activation between the low- and high-demand conditions for either RTs or accuracy. As for brain activation, we did not find the expected age group by task demand interaction, or a significant main effect of task demand. Overall, our results are compatible with some neural activation in the semantic network and the semantic control network, largely in frontotemporoparietal regions. ROI analyses demonstrated significant effects (but no interactions) of task demand in the left and right inferior frontal gyrus, the left posterior middle temporal gyrus, the posterior inferior temporal gyrus and the prefrontal gyrus. Overall, our test did not confirm the CRUNCH predictions.",Y,cc by
13,PMC11086904,10.1371/journal.pone.0302333,A novel code representation for detecting Java code clones using high-level and abstract compiled code representations.,"Quradaa FH, Shahzad S, Saeed R, Sufyan MM.",2024,"In software development, it's common to reuse existing source code by copying and pasting, resulting in the proliferation of numerous code clones-similar or identical code fragments-that detrimentally affect software quality and maintainability. Although several techniques for code clone detection exist, many encounter challenges in effectively identifying semantic clones due to their inability to extract syntax and semantics information. Fewer techniques leverage low-level source code representations like bytecode or assembly for clone detection. This work introduces a novel code representation for identifying syntactic and semantic clones in Java source code. It integrates high-level features extracted from the Abstract Syntax Tree with low-level features derived from intermediate representations generated by static analysis tools, like the Soot framework. Leveraging this combined representation, fifteen machine-learning models are trained to effectively detect code clones. Evaluation on a large dataset demonstrates the models' efficacy in accurately identifying semantic clones. Among these classifiers, ensemble classifiers, such as the LightGBM classifier, exhibit exceptional accuracy. Linearly combining features enhances the effectiveness of the models compared to multiplication and distance combination techniques. The experimental findings indicate that the proposed method can outperform the current clone detection techniques in detecting semantic clones.",Y,cc by
14,PMC11139993,10.1038/s41598-024-63195-5,Multiscale knowledge distillation with attention based fusion for robust human activity recognition.,"Yuan Z, Yang Z, Ning H, Tang X.",2024,"Knowledge distillation is an effective approach for training robust multi-modal machine learning models when synchronous multimodal data are unavailable. However, traditional knowledge distillation techniques have limitations in comprehensively transferring knowledge across modalities and models. This paper proposes a multiscale knowledge distillation framework to address these limitations. Specifically, we introduce a multiscale semantic graph mapping (SGM) loss function to enable more comprehensive knowledge transfer between teacher and student networks at multiple feature scales. We also design a fusion and tuning (FT) module to fully utilize correlations within and between different data types of the same modality when training teacher networks. Furthermore, we adopt transformer-based backbones to improve feature learning compared to traditional convolutional neural networks. We apply the proposed techniques to multimodal human activity recognition and compared with the baseline method, it improved by 2.31% and 0.29% on the MMAct and UTD-MHAD datasets. Ablation studies validate the necessity of each component.",Y,cc by
15,PMC11053063,10.1038/s41598-024-58422-y,Rate splitting with semantics as a generalized multi-access framework for intelligent reflecting surfaces.,"Jagatheesaperumal SK, Yang Z, Hassan MR, Hassan MM, Fortino G.",2024,"The rapid advancement of modern communication technologies necessitates the development of generalized multi-access frameworks and the continuous implementation of rate splitting, augmented with semantic awareness. This trend, coupled with the mounting pressure on wireless services, underscores the need for intelligent approaches to radio signal propagation. In response to these challenges, intelligent reflecting surfaces (IRS) have garnered significant attention for their ability to control data transmission systems in a goal-oriented and dynamic manner. This innovation is largely attributed to equitable resource allocation and the dynamic enhancement of network performance. However, the integration of rate-splitting multi-access (RSMA) architecture with semantic considerations imposes stringent requirements on IRS platforms to ensure seamless connectivity and broad coverage for a diverse user base without interference. Semantic communications hinge on a knowledge base-a centralized repository of integrated information related to the transmitted data-which becomes critically important in multi-antenna scenarios. This article proposes a novel set of design strategies for RSMA-IRS systems, enabled by reconfigurable intelligent surface synergizing with semantic communication principles. An experimental analysis is presented, demonstrating the effectiveness of these design guidelines in the context of Beyond 5G/6G communication systems. The RSMA-IRS model, infused with semantic communication, offers a promising solution for future wireless networks. Performance evaluations of the proposed approach reveal that, despite an increase in the number of users, the delay in the RSMA-IRS framework incorporating semantics is 2.94% less than that of a RSMA-IRS system without semantic integration.",Y,cc by
16,PMC11189566,10.1038/s41467-024-49528-y,Simple autonomous agents can enhance creative semantic discovery by human groups.,"Ueshima A, Jones MI, Christakis NA.",2024,"Innovation is challenging, and theory and experiments indicate that groups may be better able to identify and preserve innovations than individuals. But innovation within groups faces its own challenges, including groupthink and truncated diffusion. We performed experiments involving a game in which people search for ideas in various conditions: alone, in networked social groups, or in networked groups featuring autonomous agents (bots). The objective was to search a semantic space of 20,000 nouns with defined similarities for an arbitrary noun with the highest point value. Participants (N = 1875) were embedded in networks (n = 125) of 15 nodes to which we sometimes added 2 bots. The bots had 3 possible strategies: they shared a random noun generated by their immediate neighbors, or a noun most similar from among those identified, or a noun least similar. We first confirm that groups are better able to explore a semantic space than isolated individuals. Then we show that when bots that share the most similar noun operate in groups facing a semantic space that is relatively easy to navigate, group performance is superior. Simple autonomous agents with interpretable behavior can affect the capacity for creative discovery of human groups.",Y,cc by
17,PMC11035687,10.1038/s42003-024-06162-0,Revealing the mechanisms of semantic satiation with deep learning models.,"Zhang X, Lian J, Yu Z, Tang H, Liang D, Liu J, Liu JK.",2024,"The phenomenon of semantic satiation, which refers to the loss of meaning of a word or phrase after being repeated many times, is a well-known psychological phenomenon. However, the microscopic neural computational principles responsible for these mechanisms remain unknown. In this study, we use a deep learning model of continuous coupled neural networks to investigate the mechanism underlying semantic satiation and precisely describe this process with neuronal components. Our results suggest that, from a mesoscopic perspective, semantic satiation may be a bottom-up process. Unlike existing macroscopic psychological studies that suggest that semantic satiation is a top-down process, our simulations use a similar experimental paradigm as classical psychology experiments and observe similar results. Satiation of semantic objectives, similar to the learning process of our network model used for object recognition, relies on continuous learning and switching between objects. The underlying neural coupling strengthens or weakens satiation. Taken together, both neural and network mechanisms play a role in controlling semantic satiation.",Y,cc by
18,PMC11151246,,Prediction of the stage shift growth of early-stage lung adenocarcinomas by volume-doubling time,"Tang E, Wu Y, Chen C, Wu F.",2024,,Y,cc by-nc-nd
