,pmcid,doi,title,authorString,pubYear,abstractText,isOpenAccess,license
67,PMC10943221,10.1038/s41598-024-56976-5,Application of the transformer model algorithm in chinese word sense disambiguation: a case study in chinese language.,"Li L, Li J, Wang H, Nie J.",2024,"This study aims to explore the research methodology of applying the Transformer model algorithm to Chinese word sense disambiguation, seeking to resolve word sense ambiguity in the Chinese language. The study introduces deep learning and designs a Chinese word sense disambiguation model based on the fusion of the Transformer with the Bi-directional Long Short-Term Memory (BiLSTM) algorithm. By utilizing the self-attention mechanism of Transformer and the sequence modeling capability of BiLSTM, this model efficiently captures semantic information and context relationships in Chinese sentences, leading to accurate word sense disambiguation. The model's evaluation is conducted using the PKU Paraphrase Bank, a Chinese text paraphrase dataset. The results demonstrate that the model achieves a precision rate of 83.71% in Chinese word sense disambiguation, significantly outperforming the Long Short-Term Memory algorithm. Additionally, the root mean squared error of this algorithm is less than 17, with a loss function value remaining around 0.14. Thus, this study validates that the constructed Transformer-fused BiLSTM-based Chinese word sense disambiguation model algorithm exhibits both high accuracy and robustness in identifying word senses in the Chinese language. The findings of this study provide valuable insights for advancing the intelligent development of word senses in Chinese language applications.",Y,cc by
68,PMC11106303,10.1038/s41598-024-62342-2,Time division multiplexing based multi-spectral semantic camera for LiDAR applications.,"Kim S, Jeong TI, Kim S, Choi E, Yang E, Song M, Eom TJ, Kim CS, Gliserin A, Kim S.",2024,"The recent progress in the development of measurement systems for autonomous recognition had a substantial impact on emerging technology in numerous fields, especially robotics and automotive applications. In particular, time-of-flight (TOF) based light detection and ranging (LiDAR) systems enable to map the surrounding environmental information over long distances and with high accuracy. The combination of advanced LiDAR with an artificial intelligence platform allows enhanced object recognition and classification, which however still suffers from limitations of inaccuracy and misidentification. Recently, multi-spectral LiDAR systems have been employed to increase the object recognition performance by additionally providing material information in the short-wave infrared (SWIR) range where the reflection spectrum characteristics are typically very sensitive to material properties. However, previous multi-spectral LiDAR systems utilized band-pass filters or complex dispersive optical systems and even required multiple photodetectors, adding complexity and cost. In this work, we propose a time-division-multiplexing (TDM) based multi-spectral LiDAR system for semantic object inference by the simultaneous acquisition of spatial and spectral information. By utilizing the TDM method, we enable the simultaneous acquisition of spatial and spectral information as well as a TOF based distance map with minimized optical loss using only a single photodetector. Our LiDAR system utilizes nanosecond pulses of five different wavelengths in the SWIR range to acquire sufficient material information in addition to 3D spatial information. To demonstrate the recognition performance, we map the multi-spectral image from a human hand, a mannequin hand, a fabric gloved hand, a nitrile gloved hand, and a printed human hand onto an RGB-color encoded image, which clearly visualizes spectral differences as RGB color depending on the material while having a similar shape. Additionally, the classification performance of the multi-spectral image is demonstrated with a convolution neural network (CNN) model using the full multi-spectral data set. Our work presents a compact novel spectroscopic LiDAR system, which provides increased recognition performance and thus a great potential to improve safety and reliability in autonomous driving.",Y,cc by
69,PMC10710517,10.1038/s41598-023-48922-8,Central emotions and hubs in a colexification network.,"Fukuya M, Matsumoto T, Shimada Y, Ikeguchi T.",2023,"By focusing on colexification, we detected central emotions sharing semantic commonalities with many other emotions in terms of a semantic relationship of both similarity and associativity. In analysis, we created colexification networks from multiple languages by assigning a concept to a vertex and colexification to an edge. We identify concepts of emotions with a large weight in the colexification network and specify central emotions by finding hub emotions. Our resultant central emotions are four: ""GOOD,"" ""WANT,"" ""BAD,"" and ""LOVE.""",Y,cc by
70,PMC10761856,10.1038/s41598-023-50687-z,Semantic and episodic processes differently predict false memories in the DRM task.,"Gatti D, Rinaldi L, Mazzoni G, Vecchi T.",2024,"There is a fervent debate about the processes underpinning false memories formation. Seminal theories have suggested that semantic memory would be involved in false memories production, while episodic memory would counter their formation. Yet, direct evidence corroborating such view is still lacking. Here, we tested this possibility by asking participants to perform the Deese-Roediger-McDermott (DRM) task, a typical false memory paradigm, in which they had to study lists of words and subsequently to recognize and distinguish them from new words (i.e., the false memory items). The same participants were also required to perform a semantic task and an episodic-source memory task. Our results showed that a higher number of false memories in the DRM task occurred for those participants with better semantic memory abilities, while a lower number of false memories occurred for participants with better episodic abilities. These findings support a key role of semantic processes in false memory formation and, more generally, help clarify the specific contribution of different memory systems to false recognitions.",Y,cc by
71,PMC10958035,10.1038/s41598-024-55612-6,BSI-MVS: multi-view stereo network with bidirectional semantic information.,"Jia R, Yu J, Hu Z, Yuan F.",2024,"The basic principle of multi-view stereo (MVS) is to perform 3D reconstruction by extracting depth information from multiple views. Most current SOTA MVS networks are based on Vision Transformer, which usually means expensive computational complexity. To reduce computational complexity and improve depth map accuracy, we propose a MVS network with Bidirectional Semantic Information (BSI-MVS). Firstly, we design a Multi-Level Spatial Pyramid module to generate multiple layers of feature map for extracting multi-scale information. Then we propose a 2D Bidirectional-LSTM module to capture bidirectional semantic information at different time steps in the horizontal and vertical directions, which contains abundant depth information. Finally, cost volumes are built based on various levels of feature maps to optimize the final depth map. We experiment on the DTU and BlendedMVS datasets. The result shows that our network, in terms of overall metrics, surpasses TransMVSNet, CasMVSNet, CVP-MVSNet, and AACVP-MVSNet respectively by 17.84%, 36.42%, 14.96%, and 4.86%, which also shows a noticeable performance enhancement in objective metrics and visualizations.",Y,cc by
72,PMC11126598,10.1038/s41598-024-61643-w,Segmentation of void defects in X-ray images of chip solder joints based on PCB-DeepLabV3 algorithm.,"Kong D, Hu X, Gong Z, Zhang D.",2024,"Defects within chip solder joints are usually inspected visually for defects using X-ray imaging to obtain images. The phenomenon of voids inside solder joints is one of the most likely types of defects in the soldering process, and accurate detection of voids becomes difficult due to their irregular shapes, varying sizes, and defocused edges. To address this problem, an X-ray void image segmentation algorithm based on improved PCB-DeepLabV3 is proposed. Firstly, to meet the demand for lightweight and easy deployment in industrial scenarios, mobilenetv2 is used as the feature extraction backbone network of the PCB-DeepLabV3 model; then, Attentional multi-scale two-space pyramid pooling network (AMTPNet) is designed to optimize the shallow feature edges and to improve the ability to capture detailed information; finally, image cropping and cleaning methods are designed to enhance the training dataset, and the improved PCB-DeepLabV3 is applied to the training dataset. The improved PCB-DeepLabV3 model is used to segment the void regions within the solder joints and compared with the classical semantic segmentation models such as Unet, SegNet, PSPNet, and DeeplabV3. The proposed new method enables the solder joint void inspection to get rid of the traditional way of visual inspection, realize intelligent upgrading, and effectively improve the problem of difficult segmentation of the target virtual edges, to obtain the inspection results with higher accuracy.",Y,cc by
73,PMC10866900,10.1038/s41539-024-00221-1,Harmonic memory signals in the human cerebral cortex induced by semantic relatedness of words.,Noguchi Y.,2024,"When we memorize multiple words simultaneously, semantic relatedness among those words assists memory. For example, the information about ""apple"", ""banana,"" and ""orange"" will be connected via a common concept of ""fruits"" and become easy to retain and recall. Neural mechanisms underlying this semantic integration in verbal working memory remain unclear. Here I used electroencephalography (EEG) and investigated neural signals when healthy human participants memorized five nouns semantically related (Sem trial) or not (NonSem trial). The regularity of oscillatory signals (8-30 Hz) during the retention period was found to be lower in NonSem than Sem trials, indicating that memorizing words unrelated to each other induced a non-harmonic (irregular) waveform in the temporal cortex. These results suggest that (i) semantic features of a word are retained as a set of neural oscillations at specific frequencies and (ii) memorizing words sharing a common semantic feature produces harmonic brain responses through a resonance or integration (sharing) of the oscillatory signals.",Y,cc by
74,PMC10322614,10.1155/2023/9760976,Retracted: Analysis of Machine Translation and Post-Translation Editing Ability Using Semantic Information Entropy Technology.,Environmental And Public Health JO.,2023,[This retracts the article DOI: 10.1155/2022/5932044.].,Y,cc by
75,PMC10447445,10.1038/s41597-023-02480-w,Author Correction: An fMRI Dataset for Concept Representation with Semantic Feature Annotations.,"Wang S, Zhang Y, Zhang X, Sun J, Lin N, Zhang J, Zong C.",2023,,Y,cc by
76,PMC11154504,10.3390/s24020510,Beyond Conventional Monitoring: A Semantic Segmentation Approach to Quantifying Traffic-Induced Dust on Unsealed Roads.,"de Silva A, Ranasinghe R, Sounthararajah A, Haghighi H, Kodikara J.",2024,"Road dust is a mixture of fine and coarse particles released into the air due to an external force, such as tire-ground friction or wind, which is harmful to human health when inhaled. Continuous dust emission from the road surfaces is detrimental to the road itself and the road users. Due to this, multiple dust monitoring and control techniques are currently adopted in the world. The current dust monitoring methods require expensive equipment and expertise. This study introduces a novel pragmatic and robust approach to quantifying traffic-induced road dust using a deep learning method called semantic segmentation. Based on the authors' previous works, the best-performing semantic segmentation machine learning models were selected and used to identify dust in an image pixel-wise. The total number of dust pixels was then correlated with real-world dust measurements obtained from a research-grade dust monitor. Our method shows that semantic segmentation can be adopted to quantify traffic-induced dust reasonably. Over 90% of the predictions from both correlations fall in true positive quadrant, indicating that when dust concentrations are below the threshold, the segmentation can accurately predict them. The results were validated and extended for real-time application. Our code implementation is publicly available.",Y,cc by
77,PMC10444781,10.1038/s41597-023-02479-3,Author Correction: A large dataset of semantic ratings and its computational extension.,"Wang S, Zhang Y, Shi W, Zhang G, Zhang J, Lin N, Zong C.",2023,,Y,cc by
78,PMC11116941,10.1111/hex.14082,'No matter what time of day': The value of joining Facebook groups supporting women's self-management of gestational diabetes mellitus.,"Pham S, Churruca K, Ellis LA, Braithwaite J.",2024,"<h4>Background</h4>Gestational diabetes mellitus (GDM) affects a significant and growing proportion of pregnant women each year. The condition entails additional monitoring, self-management and healthcare use during pregnancy, and some women also join GDM support groups on Facebook. Little is known about the practices inside these groups, but examining them may elucidate support needs, women's experience of healthcare and improve overall outcomes. The aims of this study were to explore motivations for joining GDM Facebook groups and the perceived value and benefits of such spaces.<h4>Design</h4>A cross-sectional design using a web-based survey collected data from two peer-led GDM Facebook groups; relevant quantitative and qualitative data were extracted from open and closed questions, and analysed using descriptive statistics and content analysis.<h4>Results</h4>A total of 340 women responded to the survey, with 306 (90%) tendering their motivations to join a GDM Facebook group. Their answers were classified into six categories: peer support; information and practical advice; lived experiences; community; a safe place to ask questions and being recommended. The most commonly reported benefits of membership were 'reading about food ideas' and 'finding helpful information and tips'. Respondents reported finding their group strongly sympathetic, sincere, compassionate, heart-felt, tolerant, sensitive, warm and supportive.<h4>Discussion and conclusions</h4>GDM Facebook groups are valuable for informational and emotional support, and the sharing and perusal of lived experiences; another key benefit for women is feeling belonging to a community. GDM Facebook groups provide women with access to more tailored and readily available support, filling gaps not addressed by healthcare providers.<h4>Patient contribution</h4>This study was led by a person with lived experience of GDM, and the survey was pilot tested with women who had also experienced GDM, which contributed to its development.",Y,cc by
79,PMC10806051,10.1038/s41598-024-52562-x,Verbal fluency patterns associated with the amnestic conversion from mild cognitive impairment to dementia.,"Cintoli S, Favilli L, Morganti R, Siciliano G, Ceravolo R, Tognoni G.",2024,"Patients with amnestic mild cognitive impairment (aMCI) are at a higher risk of converting to Alzheimer's disease. The aim of this study was to examine the potential use of Verbal Fluency (VF) measures as markers for predicting the conversion to dementia. At baseline, 61 aMCI, aged 65 to 80 years, underwent a comprehensive neuropsychological assessment, including phonemic (PVF) and semantic verbal fluency (SVF) tasks. After 18 months, 14 individuals with aMCI had progressed to a diagnosis of dementia. The findings revealed that aMCI-converter group had lower Mini Mental State Examination and Rey Auditory Verbal Learning Task scores than aMCI-no converter and produced fewer clusters in both VF tasks and a lower number of switches in PVF at baseline (p < 0.05). According to receiver operating characteristic curve analysis, the number of clusters in PVF had the highest predictive value (AUC = 0.80) with a threshold of 5.510 for identifying aMCI-converter at baseline. Additionally, participants with higher levels of education exhibited more clusters and switches in VF tasks (p < 0.05). These results suggest that qualitative measures of VF could serve as neuropsychological markers for predicting cognitive decline in individuals with aMCI. Furthermore, the study highlights the potential influence of the education level on cognitive performance in neuropsychological tasks.",Y,cc by
80,PMC10879509,10.1038/s41598-024-54823-1,Dynamics of task preparation processes revealed by effect course analysis on response times and error rates.,"Berger A, Kunde W, Kiefer M.",2024,"Cuing or executing a task impacts processing pathways for task-relevant information. While there is ample evidence that processing associated with task execution changes with practice, such evidence regarding cue-induced task preparation is scarce. Here we explored practice-related changes of processing pathways by task cuing in order to assess the plasticity of task preparation. We first developed and validated a new method for the study of practice-related changes, the effect course analysis. The effect course analysis is a model-free, non-parametric method designed to reveal effect changes within an experimental session on a continuous time scale. Then we applied this method to a new study in which cued task sets were supposed to remain activated during assessment of task-relevant pathways, as potential task execution was postponed at the end of the trial. The results showed that, with little practice, task cuing amplified task-relevant pathways, whereas this effect vanished with practice, suggesting that practice prompts fundamental changes of how task cues are used for task preparation. Hence, if one cannot be certain that cognitive processing is stationary, investigating the time course of experimental effects appears to be crucial to determine how cognitive processing is influenced by practice.",Y,cc by
81,PMC10322599,10.1155/2023/9892864,Retracted: Semantic Construal Mechanism of the Linguistic Environment Parameter Theory in Business English Translation.,Environmental And Public Health JO.,2023,[This retracts the article DOI: 10.1155/2022/8953181.].,Y,cc by
82,PMC10728182,10.1038/s41598-023-49858-9,Evidence for optimal semantic search throughout adulthood.,"Zemla JC, Gooding DC, Austerweil JL.",2023,"As people age, they learn and store new knowledge in their semantic memory. Despite learning a tremendous amount of information, people can still recall information relevant to the current situation with ease. To accomplish this, the mind must efficiently organize and search a vast store of information. It also must continue to retrieve information effectively despite changes in cognitive mechanisms due to healthy aging, including a general slowing in information processing and a decline in executive functioning. How effectively does the mind of an individual adjust its search to account for changes due to aging? We tested 746 people ages 25 through 69 on a semantic fluency task (free listing animals) and found that, on average, retrieval follows an optimal path through semantic memory. Participants tended to list a sequence of semantically related animals (e.g., lion, tiger, puma) before switching to a semantically unrelated animal (e.g., whale). We found that the timing of these transitions to semantically unrelated animals was remarkably consistent with an optimal strategy for maximizing the overall rate of retrieval (i.e., the number of animals listed per unit time). Age did not affect an individual's deviation from the optimal strategy given their general performance, suggesting that people adapt and continue to search memory optimally throughout their lives. We argue that this result is more likely due to compensating for a general slowing than a decline in executive functioning.",Y,cc by
83,PMC10957906,10.1038/s41598-024-57426-y,Language prediction in monolingual and bilingual speakers: an EEG study.,"Momenian M, Vaghefi M, Sadeghi H, Momtazi S, Meyer L.",2024,"Prediction of upcoming words is thought to be crucial for language comprehension. Here, we are asking whether bilingualism entails changes to the electrophysiological substrates of prediction. Prior findings leave it open whether monolingual and bilingual speakers predict upcoming words to the same extent and in the same manner. We address this issue with a naturalistic approach, employing an information-theoretic metric, surprisal, to predict and contrast the N400 brain potential in monolingual and bilingual speakers. We recruited 18 Iranian Azeri-Persian bilingual speakers and 22 Persian monolingual speakers. Subjects listened to a story in Persian while their electroencephalogram (EEG) was recorded. Bayesian item-level analysis was used. While in monolingual speakers N400 was sensitive to information-theoretic properties of both the current and previous words, in bilingual speakers N400 reflected the properties of the previous word only. Our findings show evidence for a processing delay in bilingual speakers which is consistent with prior research.",Y,cc by
84,PMC10586498,10.3389/frai.2023.1209507,CowMesh: a data-mesh architecture to unify dairy industry data for prediction and monitoring.,"Pakrashi A, Wallace D, Mac Namee B, Greene D, Guéret C.",2023,"Dairy is an economically significant industry that caters to the huge demand for food products in people's lives. To remain profitable, farmers need to manage their farms and the health of the dairy cows in their herds. There are, however, many risks to cow health that can lead to significant challenges to dairy farm management and have the potential to lead to significant losses. Such risks include cow udder infections (i.e., mastitis) and cow lameness. As automation and data recording become more common in the agricultural sector, dairy farms are generating increasing amounts of data. Recently, these data are being used to generate insights into farm and cow health, where the objective is to help farmers manage the health and welfare of dairy cows and reduce losses from cow health issues. Despite the level of data generation on dairy farms, this information is often difficult to access due to a lack of a single, central organization to collect data from individual farms. The prospect of such an organization, however, raises questions about data ownership, with some farmers reluctant to share their farm data for privacy reasons. In this study, we describe a new <i>data mesh</i> architecture designed for the dairy industry that focuses on facilitating access to data from farms in a decentralized fashion. This has the benefit of keeping the ownership of data with dairy farmers while bringing data together by providing a common and uniform set of protocols. Furthermore, this architecture will allow secure access to the data by research groups and product development groups, who can plug in new projects and applications built across the data. No similar framework currently exists in the dairy industry, and such a data mesh can help industry stakeholders by bringing the dairy farms of a country together in a decentralized fashion. This not only helps farmers, dairy researchers, and product builders but also facilitates an overview of all dairy farms which can help governments to decide on regulations to improve the dairy industry at a national level.",Y,cc by
85,PMC11184879,10.1186/s13040-024-00371-3,Using GPT-4 to write a scientific review article: a pilot evaluation study.,"Wang ZP, Bhandary P, Wang Y, Moore JH.",2024,"GPT-4, as the most advanced version of OpenAI's large language models, has attracted widespread attention, rapidly becoming an indispensable AI tool across various areas. This includes its exploration by scientists for diverse applications. Our study focused on assessing GPT-4's capabilities in generating text, tables, and diagrams for biomedical review papers. We also assessed the consistency in text generation by GPT-4, along with potential plagiarism issues when employing this model for the composition of scientific review papers. Based on the results, we suggest the development of enhanced functionalities in ChatGPT, aiming to meet the needs of the scientific community more effectively. This includes enhancements in uploaded document processing for reference materials, a deeper grasp of intricate biomedical concepts, more precise and efficient information distillation for table generation, and a further refined model specifically tailored for scientific diagram creation.",Y,cc by
